Title,Genre,In Theaters,Critics Score,Number of Critic Ratings,Audience Score,Number of User Ratings,Budget,Box Office US & Canada,Box Office Worldwide,Runtime Minutes,Synopsis,Critics Consensus,Studio,Content Rating,URL
12 Years a Slave,Drama,2013-10-18,95%,359,90%,140025,"$22,000,000 ","$50,628,650 ","$187,000,000 ",134,"Chiwetel Ejiofor stars as Solomon Northup, the New York State citizen who was kidnapped and made to work on a plantation in New Orleans in the 1800s. Steve McQueen (Hunger) directs from a script he co-wrote with John Ridley, based in part by Northup's memoir. Michael Fassbender, Brad Pitt, Benedict Cumberbatch, Sarah Paulson, and Paul Giamatti co-star. ~ Jeremy Wheeler, Rovi","It's far from comfortable viewing, but 12 Years a Slave's unflinchingly brutal look at American slavery is also brilliant -- and quite possibly essential -- cinema.",Fox Searchlight,R ,https://www.rottentomatoes.com/m/12_years_a_slave/
20 Feet From Stardom,Documentary,2013-06-14,99%,125,82%,13479,"$1,000,000 ","$4,946,445 ","$5,800,000 ",89,"Millions know their voices, but no one knows their names. In his compelling new film 20 FEET FROM STARDOM, award-winning director Morgan Neville shines a spotlight on the untold true story of the backup singers behind some of the greatest musical legends of the 21st century. Triumphant and heartbreaking in equal measure, the film is both a tribute to the unsung voices who brought shape and style to popular music and a reflection on the conflicts, sacrifices and rewards of a career spent harmonizing with others. These gifted artists span a range of styles, genres and eras of popular music, but each has a uniquely fascinating and personal story to share of life spent in the shadows of superstardom. Along with rare archival footage and a peerless soundtrack, 20 FEET FROM STARDOM boasts intimate interviews with Bruce Springsteen, Stevie Wonder, Mick Jagger and Sting to name just a few. However, these world-famous figures take a backseat to the diverse array of backup singers whose lives and stories take center stage in the film. (c) TWC-Radius","Rich, insightful, and occasionally heartbreaking, 20 Feet From Stardom is an energetic tribute to the passion, talent, and hard work of backup singers.",Radius-TWC,PG-13 ,https://www.rottentomatoes.com/m/20_feet_from_stardom/
45 Years,Drama,2015-12-23,97%,203,67%,13732,,"$3,489,919 ","$13,900,000 ",95,"There is just one week until Kate Mercer's forty-fifth wedding anniversary and the planning for the party is going well. But then a letter arrives for her husband. The body of his first love has been discovered, frozen and preserved in the icy glaciers of the Swiss Alps. By the time the party is upon them, five days later, there may not be a marriage left to celebrate.",45 Years offers richly thought-provoking rewards for fans of adult cinema -- and a mesmerizing acting showcase for leads Charlotte Rampling and Tom Courtenay.,Sundance Selects,R ,https://www.rottentomatoes.com/m/45_years/
All Is Lost,Action & Adventure,2013-10-18,94%,234,63%,40556,"$8,500,000 ","$4,300,353 ","$13,600,000 ",105,"Academy Award-nominated writer/director J.C. Chandor (Margin Call) takes the helm for this tense adventure drama about a man (Robert Redford) who must fight for survival after being lost at sea. ~ Jason Buchanan, Rovi","Anchored by another tremendous performance in a career full of them, All Is Lost offers a moving, eminently worthwhile testament to Robert Redford's ability to hold the screen.",Lionsgate/Roadside Attractions,PG-13 ,https://www.rottentomatoes.com/m/all_is_lost_2013/
Amazing Grace,Documentary,2019-04-05,99%,149,82%,291,,"$4,450,456 ","$5,790,000 ",87,Concert footage from 1972 of Aretha Franklin performing songs from the best-selling gospel album at the New Temple Missionary Baptist Church in Los Angeles.,"Brilliantly capturing a remarkable performer near the peak of her prodigious power, Amazing Grace is a thrilling must-watch documentary for Aretha Franklin fans.",NEON,G,https://www.rottentomatoes.com/m/amazing_grace_2018/
American Hustle,Drama,2013-12-20,92%,282,74%,175743,"$40,000,000 ","$99,165,609 ","$251,200,000 ",129,"A fictional film set in the alluring world of one of the most stunning scandals to rock our nation, American Hustle tells the story of brilliant con man Irving Rosenfeld (Christian Bale), who along with his equally cunning and seductive British partner Sydney Prosser (Amy Adams) is forced to work for a wild FBI agent Richie DiMaso (Bradley Cooper). DiMaso pushes them into a world of Jersey powerbrokers and mafia that's as dangerous as it is enchanting. Jeremy Renner is Carmine Polito, the passionate, volatile, New Jersey political operator caught between the con-artists and Feds. Irving's unpredictable wife Rosalyn (Jennifer Lawrence) could be the one to pull the thread that brings the entire world crashing down. Like David O. Russell's previous films, American Hustle defies genre, hinging on raw emotion, and life and death stakes. (c) Sony","Riotously funny and impeccably cast, American Hustle compensates for its flaws with unbridled energy and some of David O. Russell's most irrepressibly vibrant direction.",Sony Pictures,R ,https://www.rottentomatoes.com/m/american_hustle/
Amy,Documentary,2015-07-03,95%,214,87%,22191,"$3,400,000 ","$7,851,076 ","$23,700,000 ",128,"Despite just two albums to her name Amy Winehouse is one of the biggest music icons in British history. With a voice oft described as a combination of Billy Holiday, Dinah Washington and Sarah Vaughan, Amy Winehouse was a pop star with soul; a once in two generational musical talent whose appeal crossed cultural and demographic boundaries. But while her music made her a star, her chaotic personal life stole headlines.","As riveting as it is sad, Amy is a powerfully honest look at the twisted relationship between art and celebrity -- and the lethal spiral of addiction.",A24 Films,R ,https://www.rottentomatoes.com/m/amy_2015/
Anomalisa,Animation,2015-12-30,92%,265,71%,19579,"$8,000,000 ","$3,759,286 ","$5,700,000 ",96,A man struggles with his inability to connect with other people.,"Anomalisa marks another brilliant and utterly distinctive highlight in Charlie Kaufman's filmography, and a thought-provoking treat for fans of introspective cinema.",Starburns Industries,R ,https://www.rottentomatoes.com/m/anomalisa/
Ant-Man and the Wasp,Action & Adventure,2018-07-06,88%,408,76%,23999,"$162,000,000 ","$216,648,740 ","$622,700,000 ",118,"From the Marvel Cinematic Universe comes a new chapter featuring heroes with the astonishing ability to shrink: ""Ant-Man and The Wasp."" In the aftermath of ""Captain America: Civil War,"" Scott Lang (Rudd) grapples with the consequences of his choices as both a Super Hero and a father. As he struggles to rebalance his home life with his responsibilities as Ant-Man, he's confronted by Hope van Dyne (Lilly) and Dr. Hank Pym (Douglas) with an urgent new mission. Scott must once again put on the suit and learn to fight alongside The Wasp as the team works together to uncover secrets from their past.","A lighter, brighter superhero movie powered by the effortless charisma of Paul Rudd and Evangeline Lilly, Ant-Man and The Wasp offers a much-needed MCU palate cleanser.",Walt Disney Pictures,PG-13 ,https://www.rottentomatoes.com/m/ant_man_and_the_wasp/
Apollo 11,Documentary,2019-03-01,99%,172,90%,883,"$9,000,000 ","$9,039,891 ","$15,300,000 ",93,Apollo 11 is a cinematic space event film fifty years in the making. Featuring never-before-seen large-format film footage of one of humanity's greatest accomplishments.,"Edifying and inspiring in equal measure, Apollo 11 uses artfully repurposed archival footage to send audiences soaring back to a pivotal time in American history.",NEON,G,https://www.rottentomatoes.com/m/apollo_11_2019/
Argo,Mystery & Suspense,2012-10-12,96%,350,90%,208496,"$44,500,000 ","$136,019,448 ","$232,300,000 ",120,"Based on true events, Argo chronicles the life-or-death covert operation to rescue six Americans, which unfolded behind the scenes of the Iran hostage crisis-the truth of which was unknown by the public for decades. On November 4, 1979, as the Iranian revolution reaches its boiling point, militants storm the U.S. embassy in Tehran, taking 52 Americans hostage. But, in the midst of the chaos, six Americans manage to slip away and find refuge in the home of the Canadian ambassador. Knowing it is only a matter of time before the six are found out and likely killed, a CIA ""exfiltration"" specialist named Tony Mendez (Ben Affleck) comes up with a risky plan to get them safely out of the country. A plan so incredible, it could only happen in the movies. -- (C) Warner Bros.","Tense, exciting, and often darkly comic, Argo recreates a historical event with vivid attention to detail and finely wrought characters.",Warner Bros. Pictures,R ,https://www.rottentomatoes.com/m/argo_2012/
Arrival,Fantasy & Science Fiction,2016-11-11,94%,413,82%,82647,"$47,000,000 ","$100,501,349 ","$203,400,000 ",116,"When mysterious spacecraft touch down across the globe, an elite team--lead by expert linguist Louise Banks (Amy Adams)--are brought together to investigate. As mankind teeters on the verge of global war, Banks and the team race against time for answers--and to find them, she will take a chance that could threaten her life, and quite possibly humanity.",Arrival delivers a must-see experience for fans of thinking person's sci-fi that anchors its heady themes with genuinely affecting emotion and a terrific performance from Amy Adams.,21 Laps Entertainment,PG-13 ,https://www.rottentomatoes.com/m/arrival_2016/
Ash Is Purest White,Drama,2019-03-15,99%,145,67%,151,,"$422,814 ","$12,000,000 ",136,"A tragicomedy initially set in the jianghu-criminal underworld-setting, ASH IS PUREST WHITE is less a gangster movie than a melodrama. With a three-part structure, it begins by following the quick-witted Qiao (Tao Zhao) and her mobster boyfriend Bin (Fan Liao) as they stake out their turf against rivals and upstarts in 2001 postindustrial Datong before expanding out into an epic narrative of how abstract forces shape individual lives, and continues Jia Zhangke's body of work as a record of 21st-century China and its warp-speed transformations.","Ash Is Purest White finds writer-director Zhangke Jia revisiting familiar themes while continuing to observe modern Chinese society with an urgent, empathetic eye.",Cohen Media Group,NR,https://www.rottentomatoes.com/m/ash_is_purest_white/
The Artist,Comedy,2011-11-25,95%,311,87%,58508,"$15,000,000 ","$44,667,095 ","$133,400,000 ",100,"Hollywood 1927. George Valentin (Jean Dujardin) is a silent movie superstar. The advent of the talkies will sound the death knell for his career and see him fall into oblivion. For young extra Peppy Miller (Berenice Bejo), it seems the sky's the limit - major movie stardom awaits. The Artist tells the story of their interlinked destinies. -- (C) Weinstein","A crowd-pleasing tribute to the magic of silent cinema, The Artist is a clever, joyous film with delightful performances and visual style to spare.",The Weinstein Company,PG-13 ,https://www.rottentomatoes.com/m/the_artist/
Avengers: Endgame,Action & Adventure,2019-04-26,94%,502,90%,67651,"$356,000,000 ","$858,373,000 ","$2,798,000,000 ",182,"The grave course of events set in motion by Thanos that wiped out half the universe and fractured the Avengers ranks compels the remaining Avengers to take one final stand in Marvel Studios' grand conclusion to twenty-two films, ""Avengers: Endgame.""","Exciting, entertaining, and emotionally impactful, Avengers: Endgame does whatever it takes to deliver a satisfying finale to Marvel's epic Infinity Saga.",Marvel Studios,PG-13 ,https://www.rottentomatoes.com/m/avengers_endgame/
Avengers: Infinity War,Action & Adventure,2018-04-27,85%,451,91%,57475,"$316,000,000 ","$664,987,816 ","$2,048,000,000 ",156,"An unprecedented cinematic journey ten years in the making and spanning the entire Marvel Cinematic Universe, Marvel Studios' ""Avengers: Infinity War"" brings to the screen the ultimate, deadliest showdown of all time. The Avengers and their Super Hero allies must be willing to sacrifice all in an attempt to defeat the powerful Thanos before his blitz of devastation and ruin puts an end to the universe.","Avengers: Infinity War ably juggles a dizzying array of MCU heroes in the fight against their gravest threat yet, and the result is a thrilling, emotionally resonant blockbuster that (mostly) realizes its gargantuan ambitions.",Walt Disney Pictures,PG-13 ,https://www.rottentomatoes.com/m/avengers_infinity_war/
The Babadook,Horror,2014-11-28,98%,235,72%,38872,"$2,000,000 ","$964,413 ","$10,300,000 ",94,"Six years after the violent death of her husband, Amelia (Essie Davis) is at a loss. She struggles to discipline her 'out of control' 6 year-old, Samuel (Noah Wiseman), a son she finds impossible to love. Samuel's dreams are plagued by a monster he believes is coming to kill them both. When a disturbing storybook called 'The Babadook' turns up at their house, Samuel is convinced that the Babadook is the creature he's been dreaming about. His hallucinations spiral out of control, he becomes more unpredictable and violent. Amelia, genuinely frightened by her son's behaviour, is forced to medicate him. But when Amelia begins to see glimpses of a sinister presence all around her, it slowly dawns on her that the thing Samuel has been warning her about may be real. (C) IFC","The Babadook relies on real horror rather than cheap jump scares -- and boasts a heartfelt, genuinely moving story to boot.",IFC Films,NR,https://www.rottentomatoes.com/m/the_babadook/
Baby Driver,Action & Adventure,2017-06-28,93%,367,86%,62515,"$34,000,000 ","$107,770,367 ","$226,900,000 ",113,"A talented, young getaway driver (Ansel Elgort) relies on the beat of his personal soundtrack to be the best in the game. But after being coerced into working for a crime boss (Kevin Spacey), he must face the music when a doomed heist threatens his life, love and freedom.","Stylish, exciting, and fueled by a killer soundtrack, Baby Driver hits the road and it's gone -- proving fast-paced action movies can be smartly written without sacrificing thrills.",Sony Pictures,R ,https://www.rottentomatoes.com/m/baby_driver/
A Beautiful Day in the Neighborhood,Drama,2019-11-22,95%,273,91%,10737,"$25,000,000 ","$58,801,961 ","$50,800,000 ",108,"Tom Hanks portrays Mister Rogers in A BEAUTIFUL DAY IN THE NEIGHBORHOOD, a timely story of kindness triumphing over cynicism, based on the true story of a real-life friendship between Fred Rogers and journalist Tom Junod. After a jaded magazine writer (Emmy winner Matthew Rhys) is assigned a profile of Fred Rogers, he overcomes his skepticism, learning about empathy, kindness, and decency from America's most beloved neighbor.","Much like the beloved TV personality that inspired it, A Beautiful Day in the Neighborhood offers a powerfully affecting message about acceptance and understanding.",TriStar Pictures,PG ,https://www.rottentomatoes.com/m/a_beautiful_day_in_the_neighborhood/
Before Midnight,Romance,2013-05-24,97%,199,82%,37318,"$3,000,000 ","$8,114,507 ","$23,300,000 ",108,"Before Midnight is an upcoming American romance drama film and the sequel to Before Sunrise (1995) and Before Sunset (2004). Like its predecessors, the film was directed by Richard Linklater. As with the previous film, Linklater shares screenplay credit with both actors from the movies, Ethan Hawke and Julie Delpy.(c) Official FB","Building on the first two installments in Richard Linklater's well-crafted Before trilogy, Before Midnight offers intelligent, powerfully acted perspectives on love, marriage, and long-term commitment.",Drafthouse Recommends,R ,https://www.rottentomatoes.com/m/before_midnight_2013/
The Big Sick,Romance,2017-07-14,98%,289,88%,32503,"$5,000,000 ","$42,824,653 ","$56,400,000 ",119,"Based on the real-life courtship between Kumail Nanjiani and Emily V. Gordon, THE BIG SICK tells the story of Pakistan-born aspiring comedian Kumail (Nanjiani), who connects with grad student Emily (Kazan) after one of his standup sets. However, what they thought would be just a one-night stand blossoms into the real thing, which complicates the life that is expected of Kumail by his traditional Muslim parents. When Emily is beset with a mystery illness, it forces Kumail to navigate the medical crisis with her parents, Beth and Terry (Holly Hunter and Ray Romano) who he's never met, while dealing with the emotional tug-of-war between his family and his heart. THE BIG SICK is directed by Michael Showalter (HELLO MY NAME IS DORIS) and producer by Judd Apatow (TRAINWRECK, THIS IS 40) and Barry Mendel (TRAINWRECK, THE ROYAL TENENBAUMS).","Funny, heartfelt, and intelligent, The Big Sick uses its appealing leads and cross-cultural themes to prove the standard romcom formula still has some fresh angles left to explore.",Amazon Studios,R ,https://www.rottentomatoes.com/m/the_big_sick/
Birdman,Drama,2014-10-17,91%,345,77%,92821,"$18,000,000 ","$42,340,598 ","$103,200,000 ",119,"BIRDMAN or The Unexpected Virtue Of Ignorance is a black comedy that tells the story of an actor (Michael Keaton) - famous for portraying an iconic superhero - as he struggles to mount a Broadway play. In the days leading up to opening night, he battles his ego and attempts to recover his family, his career, and himself. (c) Fox Searchlight","A thrilling leap forward for director Alejandro González Iñárritu, Birdman is an ambitious technical showcase powered by a layered story and outstanding performances from Michael Keaton and Edward Norton.",Fox Searchlight,R ,https://www.rottentomatoes.com/m/birdman_2014/
Birds of Passage (Pájaros de verano),Drama,2019-02-13,96%,162,88%,421,,"$507,259 ","$1,410,000 ",125,"From the Oscar (R)-nominated team behind the genre-defying Embrace of the Serpent, comes an equally audacious saga centered on the Wayúu indigenous people during a crucial period in recent Colombian history. Torn between his desire to become a powerful man and his duty to uphold his culture's values, Rapayet (José Acosta) enters the drug trafficking business in the 1970s and finds quick success despite his tribe's matriarch Ursula's (Carmiña Martínez) disapproval. Ignoring ancient omens, Rapayet and his family get caught up in a conflict where honor is the highest currency and debts are paid with blood. A sprawling epic about the erosion of tradition in pursuit of material wealth, Birds of Passage is a visually striking exploration of loyalty, greed, and the voracious nature of change.",Birds of Passage traces the familiar arc of the drug crime thriller from a different direction that's as visually absorbing as it is hard-hitting.,The Orchard,NR,https://www.rottentomatoes.com/m/birds_of_passage_2019/
Black Panther,Action & Adventure,2018-02-16,97%,490,79%,88211,"$200,000,000 ","$501,105,037 ","$1,344,000,000 ",135,"""Black Panther"" follows T'Challa who, after the events of ""Captain America: Civil War,"" returns home to the isolated, technologically advanced African nation of Wakanda to take his place as King. However, when an old enemy reappears on the radar, T'Challa's mettle as King and Black Panther is tested when he is drawn into a conflict that puts the entire fate of Wakanda and the world at risk.",Black Panther elevates superhero cinema to thrilling new heights while telling one of the MCU's most absorbing stories -- and introducing some of its most fully realized characters.,Marvel Studios,PG-13 ,https://www.rottentomatoes.com/m/black_panther_2018/
Blackfish,Documentary,2013-07-19,98%,129,90%,28609,"$1,500,000 ","$1,279,789 ","$2,300,000 ",80,"Magnolia Pictures invites you and a guest to attend an advance screening of BLACKFISH, an eye-opening documentary directed by Gabriela Cowperthwaite. Many of us have experienced the excitement and awe of watching 8,000-pound orcas, or ""killer whales,"" soar out of the water and fly through the air at sea parks, as if in perfect harmony with their trainers. Yet, in our contemporary lore this mighty black-and-white mammal is like a two-faced Janus-beloved as a majestic, friendly giant yet infamous for its capacity to kill viciously. BLACKFISH unravels the complexities of this dichotomy, employing the story of notorious performing whale Tilikum, who-unlike any orca in the wild-has taken the lives of several people while in captivity. So what exactly went wrong? Shocking, never-before-seen footage and riveting interviews with trainers and experts manifest the orca's extraordinary nature, the species' cruel treatment in captivity over the last four decades, and the growing disillusionment of workers who were misled and endangered by the highly profitable sea-park industry. This emotionally wrenching, tautly structured story challenges us to consider our relationship to nature and reveals how little we humans have learned from these highly intelligent and enormously sentient fellow mammals. (c) Magnolia","Blackfish is an aggressive, impassioned documentary that will change the way you look at performance killer whales.",Magnolia Pictures,PG-13 ,https://www.rottentomatoes.com/m/blackfish_2013/
BlacKkKlansman,Drama,2018-08-10,96%,414,82%,10438,"$15,000,000 ","$49,275,340 ","$93,400,000 ",135,"From visionary filmmaker Spike Lee comes the incredible true story of an American hero. It's the early 1970s, and Ron Stallworth (John David Washington) is the first African-American detective to serve in the Colorado Springs Police Department. Determined to make a name for himself, Stallworth bravely sets out on a dangerous mission: infiltrate and expose the Ku Klux Klan. The young detective soon recruits a more seasoned colleague, Flip Zimmerman (Adam Driver), into the undercover investigation of a lifetime. Together, they team up to take down the extremist hate group as the organization aims to sanitize its violent rhetoric to appeal to the mainstream. Produced by the team behind the Academy-Award (R) winning Get Out.",BlacKkKlansman uses history to offer bitingly trenchant commentary on current events -- and brings out some of Spike Lee's hardest-hitting work in decades along the way.,Focus Features,R ,https://www.rottentomatoes.com/m/blackkklansman/
Blade Runner 2049,Fantasy & Science Fiction,2017-10-06,87%,425,81%,59452,"$150,000,000 ","$91,800,042 ","$260,500,000 ",164,"Thirty years after the events of the first film, a new blade runner, LAPD Officer K (Ryan Gosling), unearths a long-buried secret that has the potential to plunge what's left of society into chaos. K's discovery leads him on a quest to find Rick Deckard (Harrison Ford), a former LAPD blade runner who has been missing for 30 years.","Visually stunning and narratively satisfying, Blade Runner 2049 deepens and expands its predecessor's story while standing as an impressive filmmaking achievement in its own right.",Warner Bros. Pictures,R ,https://www.rottentomatoes.com/m/blade_runner_2049/
Booksmart,Comedy,2019-05-24,97%,338,77%,4111,"$6,000,000 ","$22,680,962 ","$24,800,000 ",105,"The story follows Dever and Feldstein's characters, two academic superstars and best friends who, on the eve of their high school graduation, suddenly realize that they should have worked less and played more. Determined never to fall short of their peers, the girls set out on a mission to cram four years of fun into one night.","Fast-paced, funny, and fresh, Booksmart does the seemingly impossible by adding a smart new spin to the coming-of-age comedy.",United Artists,R ,https://www.rottentomatoes.com/m/booksmart/
Boyhood,Drama,2014-07-11,97%,313,80%,89561,"$4,000,000 ","$18,859,617 ","$57,300,000 ",165,"Filmed over 12 years with the same cast, Richard Linklater's BOYHOOD is a groundbreaking story of growing up as seen through the eyes of a child named Mason (a breakthrough performance by Ellar Coltrane), who literally grows up on screen before our eyes. Starring Ethan Hawke and Patricia Arquette as Mason's parents and newcomer Lorelei Linklater as his sister Samantha, BOYHOOD charts the rocky terrain of childhood like no other film has before. Snapshots of adolescence from road trips and family dinners to birthdays and graduations and all the moments in between become transcendent, set to a soundtrack spanning the years from Coldplay's Yellow to Arcade Fire's Deep Blue. BOYHOOD is both a nostalgic time capsule of the recent past and an ode to growing up and parenting. It's impossible to watch Mason and his family without thinking about our own journey. (c) Sundance Film Fest","Epic in technical scale but breathlessly intimate in narrative scope, Boyhood is a sprawling investigation of the human condition.",IFC Films,R ,https://www.rottentomatoes.com/m/boyhood/
BPM (Beats Per Minute) (120 battements par minute),Drama,2017-10-20,98%,126,84%,1307,"$6,200,000 ","$118,384 ","$7,700,000 ",146,"In Paris in the early 1990s, a group of activists goes to battle for those stricken with HIV/AIDS, taking on sluggish government agencies and major pharmaceutical companies in bold, invasive actions. The organization is ACT UP, and its members, many of them gay and HIV-positive, embrace their mission with a literal life-or-death urgency. Amid rallies, protests, fierce debates and ecstatic dance parties, the newcomer Nathan falls in love with Sean, the group's radical firebrand, and their passion sparks against the shadow of mortality as the activists fight for a breakthrough.","Moving without resorting to melodrama, BPM offers an engrossing look at a pivotal period in history that lingers long after the closing credits roll.",Les Films de Pierre,NR,https://www.rottentomatoes.com/m/bpm/
