Parasite (Gisaengchung),Drama,2019-10-11,99%,347,93%,3059,"$11,000,000 ","$23,850,893 ","$130,100,000 ",132,"Bong Joon Ho brings his work home to Korea in this pitch-black modern fairytale. Meet the Park Family: the picture of aspirational wealth. And the Kim Family, rich in street smarts but not much else. Be it chance or fate, these two houses are brought together and the Kims sense a golden opportunity. Masterminded by college-aged Ki-woo, the Kim children expediently install themselves as tutor and art therapist, to the Parks. Soon, a symbiotic relationship forms between the two families. The Kims provide ""indispensable"" luxury services while the Parks obliviously bankroll their entire household. When a parasitic interloper threatens the Kims' newfound comfort, a savage, underhanded battle for dominance breaks out, threatening to destroy the fragile ecosystem between the Kims and the Parks.","An urgent, brilliantly layered look at timely social themes, Parasite finds writer-director Bong Joon Ho in near-total command of his craft.",NEON,R ,https://www.rottentomatoes.com/m/parasite_2019/
Paterson,Drama,2016-12-28,96%,250,72%,15971,"$5,000,000 ","$2,141,423 ","$10,800,000 ",115,"Paterson is a bus driver in the city of Paterson, New Jersey--they share the name. Every day, Paterson adheres to a simple routine: he drives his daily route, observing the city as it drifts across his windshield and overhearing fragments of conversation swirling around him; he writes poetry into a notebook; he walks his dog; he stops in a bar and drinks exactly one beer; he goes home to his wife, Laura. By contrast, Laura's world is ever changing. New dreams come to her almost daily. Paterson loves Laura and she loves him. He supports her newfound ambitions; she champions his gift for poetry. The film quietly observes the triumphs and defeats of daily life, along with the poetry evident in its smallest details.",Paterson adds another refreshingly unvarnished entry to Jim Jarmusch's filmography -- and another outstanding performance to Adam Driver's career credits.,K5 International,R ,https://www.rottentomatoes.com/m/paterson/
The Peanut Butter Falcon,Action & Adventure,2019-08-09,95%,177,96%,4698,"$6,200,000 ","$20,457,151 ","$20,800,000 ",93,"A modern Mark Twain style adventure story, THE PEANUT BUTTER FALCON tells the story of Zak (Zack Gottsagen), a young man with Down syndrome, who runs away from a residential nursing home to follow his dream of attending the professional wrestling school of his idol, The Salt Water Redneck (Thomas Haden Church). A strange turn of events pairs him on the road with Tyler (Shia LaBeouf), a small time outlaw on the run, who becomes Zak's unlikely coach and ally. Together they wind through deltas, elude capture, drink whisky, find God, catch fish, and convince Eleanor (Dakota Johnson), a kind nursing home employee charged with Zak's return, to join them on their journey.","A feelgood adventure brought to life by outstanding performances, The Peanut Butter Falcon finds rich modern resonance in classic American fiction.",Roadside Attractions,PG-13 ,https://www.rottentomatoes.com/m/the_peanut_butter_falcon/
Phantom Thread,Drama,2018-01-19,91%,329,70%,7615,"$35,000,000 ","$947,190 ","$47,800,000 ",130,"Set in the glamour of 1950's post-war London, renowned dressmaker Reynolds Woodcock (Daniel Day-Lewis) and his sister Cyril (Lesley Manville) are at the center of British fashion, dressing royalty, movie stars, heiresses, socialites, debutants and dames with the distinct style of The House of Woodcock. Women come and go through Woodcock's life, providing the confirmed bachelor with inspiration and companionship, until he comes across a young, strong-willed woman, Alma (Vicky Krieps), who soon becomes a fixture in his life as his muse and lover. Once controlled and planned, he finds his carefully tailored life disrupted by love. With his latest film, Paul Thomas Anderson paints an illuminating portrait both of an artist on a creative journey, and the women who keep his world running. Phantom Thread is Paul Thomas Anderson's eighth movie, and his second collaboration with Daniel Day-Lewis.","Phantom Thread's finely woven narrative is filled out nicely by humor, intoxicating romantic tension, and yet another impressively committed performance from Daniel Day-Lewis.",Focus Features,R ,https://www.rottentomatoes.com/m/phantom_thread/
Phoenix,Drama,2015-07-24,98%,125,78%,12914,,"$2,164,527 ","$5,600,000 ",98,"A spellbinding mystery of identity, illusion, and deception unfolds against the turmoil of post-World War II Germany in the stunning new film from acclaimed director Christian Petzold (Barbara, Jerichow). Nelly (Nina Hoss), a German-Jewish nightclub singer, has survived a concentration camp, but with her face disfigured by a bullet wound. After undergoing reconstructive surgery, Nelly emerges with a new face, one similar but different enough that her former husband, Johnny (Ronald Zehrfeld), doesn't recognize her. Rather than reveal herself, Nelly walks into a dangerous game of duplicity and disguise as she tries to figure out if the man she loves may have been the one who betrayed her to the Nazis. Evoking the shadows and haunted mood of post-war Berlin, Phoenix weaves a complex tale of a nation's tragedy and a woman's search for answers as it builds towards an unforgettable, heart-stopping climax. (C) IFC Films","Tense, complex, and drenched in atmosphere, Phoenix is a well-acted, smartly crafted war drama that finds writer-director Christian Petzold working at peak power.",IFC Films,PG-13 ,https://www.rottentomatoes.com/m/phoenix_2015/
Portrait of a Lady on Fire (Portrait de la jeune fille en feu),Drama,2019-09-18,97%,150,88%,34,,"$118,603 ","$4,200,000 ",119,"France, 1760. Marianne is commissioned to paint the wedding portrait of Héloïse, a young woman who has just left the convent. Because she is a reluctant bride-to-be, Marianne arrives under the guise of companionship, observing Héloïse by day and secretly painting her by firelight at night. As the two women orbit one another, intimacy and attraction grow as they share Héloïse's first moments of freedom. Héloïse's portrait soon becomes a collaborative act of and testament to their love.","A singularly rich period piece, Portrait of a Lady on Fire finds stirring, thought-provoking drama within a powerfully acted romance.",NEON,R ,https://www.rottentomatoes.com/m/portrait_of_a_lady_on_fire/
The Post,Drama,2018-01-12,88%,382,73%,12104,"$50,000,000 ","$80,369,969 ","$179,800,000 ",115,"Steven Spielberg directs Meryl Streep and Tom Hanks in The Post, a thrilling drama about the unlikely partnership between The Washington Post's Katharine Graham (Streep), the first female publisher of a major American newspaper, and editor Ben Bradlee (Hanks), as they race to catch up with The New York Times to expose a massive cover-up of government secrets that spanned three decades and four U.S. Presidents. The two must overcome their differences as they risk their careers -- and their very freedom -- to help bring long-buried truths to light. The Post marks the first time Meryl Streep, Tom Hanks and Steven Spielberg have collaborated on a project. In addition to directing, Spielberg produces along with Amy Pascal and Kristie Macosko Krieger. The script was written by Liz Hannah and Josh Singer, and the film features an acclaimed ensemble cast including Alison Brie, Carrie Coon, David Cross, Bruce Greenwood, Tracy Letts, Bob Odenkirk, Sarah Paulson, Jesse Plemons, Matthew Rhys, Michael Stuhlbarg, Bradley Whitford and Zach Woods.","The Post's period setting belies its bitingly timely themes, brought compellingly to life by director Steven Spielberg and an outstanding ensemble cast.",20th Century Fox,PG-13 ,https://www.rottentomatoes.com/m/the_post/
A Quiet Place,Horror,2018-04-06,95%,364,83%,22169,"$17,000,000 ","$188,024,361 ","$340,900,000 ",90,"In the modern horror thriller A QUIET PLACE, a family of four must navigate their lives in silence after mysterious creatures that hunt by sound threaten their survival. If they hear you, they hunt you.",A Quiet Place artfully plays on elemental fears with a ruthlessly intelligent creature feature that's as original as it is scary -- and establishes director John Krasinski as a rising talent.,Paramount Pictures,PG-13 ,https://www.rottentomatoes.com/m/a_quiet_place_2018/
Rocketman,Drama,2019-05-31,89%,355,88%,21646,"$40,000,000 ","$96,368,160 ","$195,200,000 ",121,"ROCKETMAN is an epic musical fantasy about the incredible human story of Elton John's breakthrough years. The film follows the fantastical journey of transformation from shy piano prodigy Reginald Dwight into international superstar Elton John. This inspirational story -- set to Elton John's most beloved songs and performed by star Taron Egerton -- tells the universally relatable story of how a small-town boy became one of the most iconic figures in pop culture. ROCKETMAN also stars Jamie Bell as Elton's longtime lyricist and writing partner Bernie Taupin, Richard Madden as Elton's first manager, John Reid, and Bryce Dallas Howard as Elton's mother Sheila Farebrother.","It's going to be a long, long time before a rock biopic manages to capture the highs and lows of an artist's life like Rocketman.",Paramount Pictures,R ,https://www.rottentomatoes.com/m/rocketman_2019/
Roma,Drama,2018-11-21,96%,373,72%,5193,"$15,000,000 ","$4,000,000 ","$5,100,000 ",135,"The most personal project to date from Academy Award (R)-winning director and writer Alfonso Cuarón (Gravity, Children of Men, Y Tu Mama Tambien), ROMA follows Cleo (Yalitza Aparicio), a young domestic worker for a family in the middle-class neighborhood of Roma in Mexico City. Delivering an artful love letter to the women who raised him, Cuarón draws on his own childhood to create a vivid and emotional portrait of domestic strife and social hierarchy amidst political turmoil of the 1970s. Cuarón's first project since the groundbreaking Gravity in 2013, ROMA will be available in theaters and on Netflix later this year.","Roma finds writer-director Alfonso Cuarón in complete, enthralling command of his visual craft - and telling the most powerfully personal story of his career.",Netflix,R ,https://www.rottentomatoes.com/m/roma_2018/
Room,Drama,2015-10-16,93%,307,93%,49371,"$13,000,000 ","$14,677,654 ","$36,300,000 ",113,"Both highly suspenseful and deeply emotional, ROOM is a unique and touching exploration of the boundless love between a mother and her child. After 5-year-old Jack (Jacob Tremblay) and his Ma (Brie Larson) escape from the enclosed surroundings that Jack has known his entire life, the boy makes a thrilling discovery: the outside world. As he experiences all the joy, excitement, and fear that this new adventure brings, he holds tight to the one thing that matters most of all--his special bond with his loving and devoted Ma.","Led by incredible work from Brie Larson and Jacob Tremblay, Room makes for an unforgettably harrowing -- and undeniably rewarding -- experience.",Element Pictures,R ,https://www.rottentomatoes.com/m/room_2015/
The Rider,Drama,2018-04-13,97%,175,82%,1968,,"$2,419,031 ","$3,400,000 ",104,"Based on his a true story, THE RIDER stars breakout Brady Jandreau as a once rising star of the rodeo circuit warned that his competition days are over after a tragic riding accident. Back home, Brady finds himself wondering what he has to live for when he can no longer do what gives him a sense of purpose: to ride and compete. In an attempt to regain control of his fate, Brady undertakes a search for new identity and tries to redefine his idea of what it means to be a man in the heartland of America.",The Rider's hard-hitting drama is only made more effective through writer-director Chloé Zhao's use of untrained actors to tell the movie's fact-based tale.,Sony Pictures Classics,R ,https://www.rottentomatoes.com/m/the_rider/
The Salesman (Forushande),Drama,2017-01-27,96%,192,84%,7319,,"$11,067 ","$6,953,000 ",125,"Forced to leave their apartment due to a dangerous construction project in a neighboring building, a young Iranian couple moves to the center of Tehran where they become embroiled in a life-altering situation involving the previous tenant. Directed by Asghar Farhadi, who also helmed the Oscar-winning feature A Separation.","The Salesman takes an ambitiously complex look at thought-provoking themes, and the well-acted results prove another consistently absorbing entry in writer-director Asghar Farhadi's distinguished filmography.",Cohen Media Group,PG-13 ,https://www.rottentomatoes.com/m/the_salesman_2017/
Searching,Mystery & Suspense,2018-08-31,92%,242,87%,6474,"$880,000 ","$26,020,957 ","$75,500,000 ",101,"After David Kim (John Cho)'s 16-year-old daughter goes missing, a local investigation is opened and a detective is assigned to the case. But 37 hours later and without a single lead, David decides to search the one place no one has looked yet, where all secrets are kept today: his daughter's laptop. In a hyper-modern thriller told via the technology devices we use every day to communicate, David must trace his daughter's digital footprints before she disappears forever.",Searching's timely premise and original execution are further bolstered by well-rounded characters brought to life by a talented cast.,Screen Gems,PG-13 ,https://www.rottentomatoes.com/m/searching_2018/
Selma,Drama,2014-12-25,99%,303,86%,61334,"$20,000,000 ","$52,076,908 ","$66,800,000 ",127,"SELMA is the story of a movement. The film chronicles the tumultuous three-month period in 1965, when Dr. Martin Luther King, Jr. led a dangerous campaign to secure equal voting rights in the face of violent opposition. The epic march from Selma to Montgomery culminated in President Johnson (Tom Wilkinson) signing the Voting Rights Act of 1965, one of the most significant victories for the civil rights movement. Director Ava DuVernays SELMA tells the real story of how the revered leader and visionary Dr. Martin Luther King Jr. (David Oyelowo) and his brothers and sisters in the movement prompted change that forever altered history.(C) Paramount","Fueled by a gripping performance from David Oyelowo, Selma draws inspiration and dramatic power from the life and death of Martin Luther King, Jr. -- but doesn't ignore how far we remain from the ideals his work embodied.",Paramount Pictures,PG-13 ,https://www.rottentomatoes.com/m/selma/
A Separation,Drama,2011-12-30,99%,173,92%,22805,"$800,000 ","$6,700,000 ","$24,400,000 ",123,"Set in contemporary Iran, A Separation is a compelling drama about the dissolution of a marriage. Simin wants to leave Iran with her husband Nader and daughter Termeh. Simin sues for divorce when Nader refuses to leave behind his Alzheimer-suffering father. Her request having failed, Simin returns to her parents' home, but Termeh decides to stay with Nader. When Nader hires a young woman to assist with his father in his wife's absence, he hopes that his life will return to a normal state. However, when he discovers that the new maid has been lying to him, he realizes that there is more on the line than just his marriage. -- (C) Sony Pictures Classics","Morally complex, suspenseful, and consistently involving, A Separation captures the messiness of a dissolving relationship with keen insight and searing intensity.",Sony Pictures Classics,PG-13 ,https://www.rottentomatoes.com/m/a_separation_2011/
The Shape of Water,Fantasy & Science Fiction,2017-12-22,92%,428,72%,25311,"$20,000,000 ","$57,393,976 ","$195,200,000 ",119,"From master story teller, Guillermo del Toro, comes THE SHAPE OF WATER - an other-worldly fairy tale, set against the backdrop of Cold War era America circa 1962. In the hidden high-security government laboratory where she works, lonely Elisa (Sally Hawkins) is trapped in a life of isolation. Elisa's life is changed forever when she and co-worker Zelda (Octavia Spencer) discover a secret classified experiment. Rounding out the cast are Michael Shannon, Richard Jenkins, Doug Jones and Michael Stuhlbarg.",The Shape of Water finds Guillermo del Toro at his visually distinctive best -- and matched by an emotionally absorbing story brought to life by a stellar Sally Hawkins performance.,Fox Searchlight Pictures,R ,https://www.rottentomatoes.com/m/the_shape_of_water_2017/
Shaun the Sheep Movie,Animation,2015-08-05,99%,165,80%,22609,"$25,000,000 ","$19,375,982 ","$106,200,000 ",84,"When Shaun decides to take the day off and have some fun, he gets a little more action than he bargained for. A mix up with the Farmer, a caravan, and a very steep hill lead them all to the Big City and it's up to Shaun and the flock to return everyone safely to the green grass of home. (C) Lionsgate","Warm, funny, and brilliantly animated, Shaun the Sheep is yet another stop-motion jewel in Aardman's family-friendly crown.",Lionsgate,PG ,https://www.rottentomatoes.com/m/shaun_the_sheep_movie/
Shazam!,Action & Adventure,2019-04-05,90%,385,83%,15854,"$100,000,000 ","$140,371,656 ","$364,600,000 ",130,"We all have a superhero inside us, it just takes a bit of magic to bring it out. In Billy Batson's (Asher Angel) case, by shouting out one word--SHAZAM!--this streetwise 14-year-old foster kid can turn into the adult Super Hero Shazam (Zachary Levi), courtesy of an ancient wizard. Still a kid at heart--inside a ripped, godlike body--Shazam revels in this adult version of himself by doing what any teen would do with superpowers: have fun with them! Can he fly? Does he have X-ray vision? Can he shoot lightning out of his hands? Can he skip his social studies test? Shazam sets out to test the limits of his abilities with the joyful recklessness of a child. But he'll need to master these powers quickly in order to fight the deadly forces of evil controlled by Dr. Thaddeus Sivana (Strong).","An effortlessly entertaining blend of humor and heart, Shazam! is a superhero movie that never forgets the genre's real power: joyous wish fulfillment.",New Line Cinema,PG-13 ,https://www.rottentomatoes.com/m/shazam/
Shoplifters (Manbiki kazoku),Drama,2018-11-23,99%,218,91%,1996,"$7,000,000 ","$3,313,513 ","$72,700,000 ",121,"After one of their shoplifting sessions, Osamu and his son come across a little girl in the freezing cold. At first reluctant to shelter the girl, Osamu's wife agrees to take care of her after learning of the hardships she faces. Although the family is poor, barely making enough money to survive through petty crime, they seem to live happily together until an unforeseen incident reveals hidden secrets, testing the bonds that unite them...","Understated yet ultimately deeply affecting, Shoplifters adds another powerful chapter to director Hirokazu Koreeda's richly humanistic filmography.",Magnolia Pictures,R ,https://www.rottentomatoes.com/m/shoplifters/
Short Term 12,Drama,2013-08-23,98%,169,92%,21403,"$1,000,000 ","$1,013,100 ","$2,300,000 ",21,"I Am Not a Hipster director Destin Daniel Cretton expands his 2008 short of the same name into a feature film depicting the struggles of a compassionate twentysomething contending with some unexpected life developments while working as a supervisor at a home for at-risk teens. Grace (Brie Larson) has dedicated her life to helping kids who have slipped through the cracks of the system. Committed to her job and in love with kindhearted co-worker Mason (John Gallagher Jr.), she's still struggling to make sense of her own troubled past when she learns that her life is about to change forever. Meanwhile, into the facility walks a young girl who's been constantly shifted between group homes due to dangerous behavior. Almost immediately, Grace forges a powerful connection with her new charge. Now if Grace can just open up to Mason the way she encourages her kids to open up to her, she may find a way to make peace with the future while still providing support to the kids who depend on her the most. ~ Jason Buchanan, Rovi","Short Term 12 is an emphatic, revealing drama that pulls audiences into the perspective of neglected youths.",Cinedigm,R ,https://www.rottentomatoes.com/m/short_term_12_2013/
Sicario,Action & Adventure,2015-10-02,92%,267,85%,67465,"$30,000,000 ","$46,889,293 ","$84,900,000 ",121,"In the lawless border area stretching between the U.S. and Mexico, an idealistic FBI agent [Emily Blunt] is enlisted by an elite government task force official [Josh Brolin] to aid in the escalating war against drugs. Led by an enigmatic consultant with a questionable past [Benicio Del Toro], the team sets out on a clandestine journey forcing Kate to question everything that she believes in order to survive. (C) Lionsgate","Led by outstanding work from Emily Blunt and Benicio del Toro, Sicario is a taut, tightly wound thriller with much more on its mind than attention-getting set pieces.",Lionsgate,R ,https://www.rottentomatoes.com/m/sicario_2015/
Sing Street,Drama,2016-04-15,95%,205,92%,16844,"$4,000,000 ","$3,233,839 ","$13,600,000 ",106,"From director John Carney (ONCE, BEGIN AGAIN), SING STREET takes us back to 1980s Dublin seen through the eyes of a 14-year-old boy named Conor (Ferdia Walsh-Peelo) who is looking for a break from a home strained by his parents' relationship and money troubles, while trying to adjust to his new inner-city public school where the kids are rough and the teachers are rougher. He finds a glimmer of hope in the mysterious, über-cool and beautiful Raphina (Lucy Boynton), and with the aim of winning her heart he invites her to star in his band's music videos. There's only one problem: he's not part of a band...yet. She agrees, and now Conor must deliver what he's promised - calling himself ""Cosmo"" and immersing himself in the vibrant rock music trends of the decade, he forms a band with a few lads, and the group pours their heart into writing lyrics and shooting videos. Inspired by writer/director John Carney's life and love for music, SING STREET shows us a world where music has the power to take us away from the turmoil of everyday life and transform us into something greater.","Sing Street is a feel-good musical with huge heart and irresistible optimism, and its charmimg cast and hummable tunes help to elevate its familiar plotting.",Likely Story,PG-13 ,https://www.rottentomatoes.com/m/sing_street/
Skyfall,Action & Adventure,2012-11-09,92%,371,86%,373627,"$200,000,000 ","$299,300,000 ","$1,109,000,000 ",145,"In Skyfall, Bond's loyalty to M is tested as her past comes back to haunt her. As MI6 comes under attack, 007 must track down and destroy the threat, no matter how personal the cost. -- (C) Official Site","Sam Mendes brings Bond surging back with a smart, sexy, riveting action thriller that qualifies as one of the best 007 films to date.",MGM,PG-13 ,https://www.rottentomatoes.com/m/skyfall/
Snowpiercer,Fantasy & Science Fiction,2014-06-27,95%,243,72%,58711,"$40,000,000 ","$2,786,828 ","$86,800,000 ",126,"In this sci-fi epic from director Bong Joon Ho (The Host, Mother), a failed global-warming experiment kills off most life on the planet. The final survivors board the SNOWPIERCER, a train that travels around the globe via a perpetual-motion engine. When cryptic messages incite the passengers to revolt, the train thrusts full-throttle towards disaster. (c) TWC-Radius",Snowpiercer offers an audaciously ambitious action spectacular for filmgoers numb to effects-driven blockbusters.,Radius-TWC,R ,https://www.rottentomatoes.com/m/snowpiercer/
The Social Network,Drama,2010-10-01,96%,314,86%,203610,"$50,000,000 ","$96,400,000 ","$224,900,000 ",120,"""The Social Network"" explores the moment at which Facebook, the most revolutionary social phenomena of the new century, was invented -- through the warring perspectives of the super-smart young men who each claimed to be there at its inception. The result is a drama rife with both creation and destruction; one that audaciously avoids a singular POV, but instead, by tracking dueling narratives, mirrors the clashing truths and constantly morphing social relationships that define our time. Drawn from multiple sources, the film captures the visceral thrill of the heady early days of a culture-changing phenomenon in the making -- and the way it both pulled a group of young revolutionaries together and then split them apart.","Impeccably scripted, beautifully directed, and filled with fine performances, The Social Network is a riveting, ambitious example of modern filmmaking at its finest.",Columbia Pictures,PG-13 ,https://www.rottentomatoes.com/m/the-social-network/
Son of Saul,Drama,2015-12-18,96%,226,80%,12945,"$1,670,000 ","$1,777,043 ","$9,700,000 ",107,"In this searing drama, a concentration camp inmate tasked with burning the dead discovers the body of his young son, and must choose between participating in the clandestine uprising being planned among the prisoners, or securing a proper Jewish burial for his child.","Grimly intense yet thoroughly rewarding, Son of Saul offers an unforgettable viewing experience -- and establishes director László Nemes as a talent to watch.",Sony Pictures Classics,R ,https://www.rottentomatoes.com/m/son_of_saul/
